Section	Action	URI	Applicable	Reasoning
Obligations	present	http://www.w3.org/ns/odrl/2/present	NO	There is no obligation to present the material.
Obligations	print	http://www.w3.org/ns/odrl/2/print	NO	There is no obligation to print the material.
Obligations	read	http://www.w3.org/ns/odrl/2/read	NO	There is no obligation to read the material.
Obligations	reproduce	http://www.w3.org/ns/odrl/2/reproduce	NO	There is no obligation to reproduce the material.
Obligations	reproduction	http://creativecommons.org/ns#Reproduction	NO	There is no obligation to make reproductions.
Obligations	review policy	http://www.w3.org/ns/odrl/2/reviewPolicy	NO	There is no obligation to review any policy.
Obligations	sell	http://www.w3.org/ns/odrl/2/sell	NO	There is no obligation to sell the material.
Obligations	share Alike	http://creativecommons.org/ns#ShareAlike	NO	This is not a CC BY-ND license requirement.
Obligations	sharing	http://creativecommons.org/ns#Sharing	NO	There is no obligation to share the material. The obligations apply *if* one chooses to share.
Obligations	source code	http://www.w3.org/ns/odrl/2/sourceCode	NO	There is no obligation under CC BY-ND to provide source code.
Obligations	stream	http://www.w3.org/ns/odrl/2/stream	NO	There is no obligation to stream the material.
Obligations	synchronize	http://www.w3.org/ns/odrl/2/synchronize	NO	There is no obligation to synchronize the material.
Obligations	Text-to-speech	http://www.w3.org/ns/odrl/2/textToSpeech	NO	There is no obligation to create a text-to-speech version.
Obligations	transform	http://www.w3.org/ns/odrl/2/transform	NO	There is no obligation to transform the material.
Obligations	translate	http://www.w3.org/ns/odrl/2/translate	NO	There is no obligation to translate the material.
Obligations	uninstall	http://www.w3.org/ns/odrl/2/uninstall	NO	There is no obligation to uninstall material.
Obligations	use	http://www.w3.org/ns/odrl/2/use	NO	There is no obligation to use the material.
Obligations	watermark	http://www.w3.org/ns/odrl/2/watermark	NO	There is no obligation to apply a watermark. In fact, applying one for distribution could be a prohibited modification.