Section	Action	URI	Applicable	Reasoning
Obligations	source code	http://www.w3.org/ns/odrl/2/sourceCode	NO	The license does not generally obligate providing source code unless the licensed material is software and providing source code is the established norm for sharing that type of software under an open license and is necessary to exercise the rights. This specific ODRL action is about the policy's source.
Obligations	stream	http://www.w3.org/ns/odrl/2/stream	NO	There is no obligation to stream the material.
Obligations	synchronize	http://www.w3.org/ns/odrl/2/synchronize	NO	There is no obligation to synchronize material.
Obligations	Text-to-speech	http://www.w3.org/ns/odrl/2/textToSpeech	NO	There is no obligation to create a text-to-speech version.
Obligations	transform	http://www.w3.org/ns/odrl/2/transform	NO	There is no obligation to transform the material. If you do obligations apply.
Obligations	translate	http://www.w3.org/ns/odrl/2/translate	NO	There is no obligation to translate the material. If you do (creating an adaptation) then ShareAlike and Attribution obligations apply.
Obligations	uninstall	http://www.w3.org/ns/odrl/2/uninstall	NO	There is no obligation to uninstall the material.
Obligations	use	http://www.w3.org/ns/odrl/2/use	NO	There is no obligation to use the material.
Obligations	watermark	http://www.w3.org/ns/odrl/2/watermark	NO	There is no obligation to add a watermark. There is an obligation not to remove existing copyright management information which might include watermarks (Section 3.a.1).